{"audience":"furatena.preview","binding":{"head_sha":"aaaaaaaaaaaaaaaaaaaaaaaaaaaaaaaaaaaaaaaa","origin":"https://pr-518.preview.example","pull_request_number":518,"repository_id":"repository-4242"},"client_kind":"browser","code_challenge":"-qu8bhLQJ_mEmN6kd-UxSAeUzXa6O0aTsjEw81YDjqQ","code_challenge_method":"S256","expires_at":"2030-01-01T00:05:00Z","nonce":"bbbbbbbbbbbbbbbbbbbbbbbbbbbbbbbbbbbbbbbbbbb","record_type":"furatena.preview-auth.authorization-request","redirect_uri":"https://pr-518.preview.example/_fura/preview-auth/callback","request_id":"aaaaaaaaaaaaaaaaaaaaaaaaaaaaaaaaaaaaaaaaaaa","requested_at":"2030-01-01T00:00:00Z","schema_version":1,"state":"sssssssssssssssssssssssssssssssssssssssssss"}
